{
  "schemaVersion": 1,
  "authority": "vibespace.sakura.motion.v1",
  "sourceRoot": "app/src",
  "policies": {
    "priorThemes": "exact-legacy-transition-object",
    "sakura": "220ms-calm-no-overshoot-tween",
    "reducedMotion": "zero-duration",
    "layout": "disabled-or-zero-duration-for-sakura-and-reduced-motion"
  },
  "entries": [
    {
      "id": "shell.default",
      "path": "app/src/components/layout/AppShell.tsx",
      "line": 20,
      "occurrence": 1,
      "locator": "LEGACY_SHELL_TRANSITION",
      "role": "root MotionConfig fallback",
      "legacy": { "type": "spring", "stiffness": 400, "damping": 30 },
      "consumers": [
        "app/src/components/layout/AppShell.tsx#useThemeMotionTransition(LEGACY_SHELL_TRANSITION)"
      ],
      "sakuraReachable": true,
      "ownerLane": "root-task427",
      "sakuraPolicy": "shared-theme-policy",
      "reducedMotionPolicy": "zero-duration",
      "binding": "useThemeMotionTransition",
      "layoutAffecting": false,
      "layoutPolicy": "not-applicable",
      "semanticException": null
    },
    {
      "id": "inspector.resize",
      "path": "app/src/components/layout/Inspector.tsx",
      "line": 74,
      "occurrence": 1,
      "locator": "LEGACY_INSPECTOR_TRANSITION",
      "role": "inspector width open and close",
      "legacy": { "type": "spring", "stiffness": 400, "damping": 30 },
      "consumers": [
        "app/src/components/layout/Inspector.tsx#useThemeLayoutTransition(LEGACY_INSPECTOR_TRANSITION)"
      ],
      "sakuraReachable": true,
      "ownerLane": "root-task427",
      "sakuraPolicy": "shared-theme-policy",
      "reducedMotionPolicy": "zero-duration",
      "binding": "useThemeLayoutTransition",
      "layoutAffecting": true,
      "layoutPolicy": "instant",
      "semanticException": null
    },
    {
      "id": "nav.resize",
      "path": "app/src/components/layout/NavPane.tsx",
      "line": 51,
      "occurrence": 1,
      "locator": "LEGACY_NAV_PANE_TRANSITION",
      "role": "navigation width collapse and expand",
      "legacy": { "type": "spring", "stiffness": 400, "damping": 30 },
      "consumers": [
        "app/src/components/layout/NavPane.tsx#useThemeLayoutTransition(LEGACY_NAV_PANE_TRANSITION)"
      ],
      "sakuraReachable": true,
      "ownerLane": "root-task427",
      "sakuraPolicy": "shared-theme-policy",
      "reducedMotionPolicy": "zero-duration",
      "binding": "useThemeLayoutTransition",
      "layoutAffecting": true,
      "layoutPolicy": "instant",
      "semanticException": null
    },
    {
      "id": "tabs.item",
      "path": "app/src/components/layout/TabStrip.tsx",
      "line": 74,
      "occurrence": 1,
      "locator": "LEGACY_TAB_TRANSITION",
      "role": "tab entrance exit and reflow",
      "legacy": { "type": "spring", "stiffness": 400, "damping": 30 },
      "consumers": [
        "app/src/components/layout/TabStrip.tsx#useThemeMotionTransition(LEGACY_TAB_TRANSITION)"
      ],
      "sakuraReachable": true,
      "ownerLane": "root-task427",
      "sakuraPolicy": "shared-theme-policy",
      "reducedMotionPolicy": "zero-duration",
      "binding": "useThemeMotionTransition",
      "layoutAffecting": true,
      "layoutPolicy": "disabled",
      "semanticException": null
    },
    {
      "id": "toast.item",
      "path": "app/src/components/ui/toast.tsx",
      "line": 10,
      "occurrence": 1,
      "locator": "LEGACY_TOAST_TRANSITION",
      "role": "toast entrance exit and stack reflow",
      "legacy": { "type": "spring", "stiffness": 400, "damping": 30 },
      "consumers": [
        "app/src/components/ui/toast.tsx#useThemeMotionTransition(LEGACY_TOAST_TRANSITION)"
      ],
      "sakuraReachable": true,
      "ownerLane": "root-task427",
      "sakuraPolicy": "shared-theme-policy",
      "reducedMotionPolicy": "zero-duration",
      "binding": "useThemeMotionTransition",
      "layoutAffecting": true,
      "layoutPolicy": "disabled",
      "semanticException": null
    },
    {
      "id": "chat.dropdown",
      "path": "app/src/features/chat/dropdownMotion.ts",
      "line": 7,
      "occurrence": 1,
      "locator": "LEGACY_DROPDOWN_TRANSITION",
      "role": "shared chat picker dropdown entrance",
      "legacy": { "type": "spring", "stiffness": 500, "damping": 30 },
      "consumers": [
        "app/src/features/chat/ModelPickerTypeahead.tsx#useThemeMotionTransition(LEGACY_DROPDOWN_TRANSITION)",
        "app/src/features/chat/SlashCommandOptionPicker.tsx#useThemeMotionTransition(LEGACY_DROPDOWN_TRANSITION)",
        "app/src/features/chat/SlashCommandTypeahead.tsx#useThemeMotionTransition(LEGACY_DROPDOWN_TRANSITION)"
      ],
      "sakuraReachable": true,
      "ownerLane": "root-task427",
      "sakuraPolicy": "shared-theme-policy",
      "reducedMotionPolicy": "zero-duration",
      "binding": "consumer-useThemeMotionTransition",
      "layoutAffecting": false,
      "layoutPolicy": "not-applicable",
      "semanticException": null
    },
    {
      "id": "chat.empty",
      "path": "app/src/features/chat/EmptyChat.tsx",
      "line": 13,
      "occurrence": 1,
      "locator": "spring",
      "role": "empty chat entrance",
      "legacy": { "type": "spring", "stiffness": 400, "damping": 30, "mass": 0.8 },
      "consumers": ["app/src/features/chat/EmptyChat.tsx#useThemeMotionTransition(spring)"],
      "sakuraReachable": true,
      "ownerLane": "root-task427",
      "sakuraPolicy": "shared-theme-policy",
      "reducedMotionPolicy": "zero-duration",
      "binding": "useThemeMotionTransition",
      "layoutAffecting": false,
      "layoutPolicy": "not-applicable",
      "semanticException": null
    },
    {
      "id": "chat.input-token",
      "path": "app/src/features/chat/InputToken.tsx",
      "line": 78,
      "occurrence": 1,
      "locator": "TOKEN_TRANSITION",
      "role": "composer input token entrance and exit",
      "legacy": { "type": "spring", "stiffness": 520, "damping": 26, "mass": 0.7 },
      "consumers": [
        "app/src/features/chat/InputToken.tsx#useThemeMotionTransition(TOKEN_TRANSITION)"
      ],
      "sakuraReachable": true,
      "ownerLane": "worker-task428",
      "sakuraPolicy": "shared-theme-policy",
      "reducedMotionPolicy": "zero-duration",
      "binding": "useThemeMotionTransition",
      "layoutAffecting": false,
      "layoutPolicy": "not-applicable",
      "semanticException": null
    },
    {
      "id": "chat.message",
      "path": "app/src/features/chat/MessageBubble.tsx",
      "line": 18,
      "occurrence": 1,
      "locator": "MESSAGE_TRANSITION",
      "role": "chat message entrance and reflow",
      "legacy": { "type": "spring", "stiffness": 400, "damping": 30, "mass": 0.8 },
      "consumers": [
        "app/src/features/chat/MessageBubble.tsx#useThemeMotionTransition(MESSAGE_TRANSITION)"
      ],
      "sakuraReachable": true,
      "ownerLane": "worker-task428",
      "sakuraPolicy": "shared-theme-policy",
      "reducedMotionPolicy": "zero-duration",
      "binding": "useThemeMotionTransition",
      "layoutAffecting": true,
      "layoutPolicy": "disabled",
      "semanticException": null
    },
    {
      "id": "chat.tool-expansion",
      "path": "app/src/features/chat/ToolCallCard.tsx",
      "line": 30,
      "occurrence": 1,
      "locator": "EXPANSION_TRANSITION",
      "role": "tool details height expansion",
      "legacy": { "type": "spring", "stiffness": 400, "damping": 30, "mass": 0.8 },
      "consumers": [
        "app/src/features/chat/ToolCallCard.tsx#useThemeLayoutTransition(EXPANSION_TRANSITION)"
      ],
      "sakuraReachable": true,
      "ownerLane": "worker-task428",
      "sakuraPolicy": "shared-theme-policy",
      "reducedMotionPolicy": "zero-duration",
      "binding": "useThemeLayoutTransition",
      "layoutAffecting": true,
      "layoutPolicy": "instant",
      "semanticException": null
    },
    {
      "id": "council.panel",
      "path": "app/src/features/council/AgentPanel.tsx",
      "line": 21,
      "occurrence": 1,
      "locator": "PANEL_TRANSITION",
      "role": "council agent panel entrance and reflow",
      "legacy": { "type": "spring", "stiffness": 400, "damping": 30, "mass": 0.8 },
      "consumers": [
        "app/src/features/council/AgentPanel.tsx#useThemeMotionTransition(PANEL_TRANSITION)"
      ],
      "sakuraReachable": true,
      "ownerLane": "worker-task428",
      "sakuraPolicy": "shared-theme-policy",
      "reducedMotionPolicy": "zero-duration",
      "binding": "useThemeMotionTransition",
      "layoutAffecting": true,
      "layoutPolicy": "disabled",
      "semanticException": null
    },
    {
      "id": "council.message",
      "path": "app/src/features/council/AgentPanel.tsx",
      "line": 22,
      "occurrence": 1,
      "locator": "MESSAGE_TRANSITION",
      "role": "council message entrance and reflow",
      "legacy": { "type": "spring", "stiffness": 500, "damping": 32, "mass": 0.6 },
      "consumers": [
        "app/src/features/council/AgentPanel.tsx#useThemeMotionTransition(MESSAGE_TRANSITION)"
      ],
      "sakuraReachable": true,
      "ownerLane": "worker-task428",
      "sakuraPolicy": "shared-theme-policy",
      "reducedMotionPolicy": "zero-duration",
      "binding": "useThemeMotionTransition",
      "layoutAffecting": true,
      "layoutPolicy": "disabled",
      "semanticException": null
    },
    {
      "id": "mode.option",
      "path": "app/src/features/jarvis-interaction/ModeIndicator.tsx",
      "line": 31,
      "occurrence": 1,
      "locator": "OPTION_TRANSITION",
      "role": "interaction mode option entrance",
      "legacy": { "type": "spring", "stiffness": 420, "damping": 28 },
      "consumers": [
        "app/src/features/jarvis-interaction/ModeIndicator.tsx#useThemeMotionTransition(OPTION_TRANSITION)"
      ],
      "sakuraReachable": true,
      "ownerLane": "worker-task428",
      "sakuraPolicy": "shared-theme-policy",
      "reducedMotionPolicy": "zero-duration",